{
  "schema_version": "1.3.0",
  "artefact": "separation",
  "artefact_version": 1,
  "analysis_id": "0192f6c4-8b00-7a00-8000-0000000000aa",
  "user_id": "usr_01JB7Q3K9W2F",
  "audio_hash": "f6ea3271a3f5d48649cb7c1741eafdaad1c65e7879536b91dc998068277be630",
  "sample_rate": 44100,
  "duration_s": 20.5,
  "models": [
    {
      "model_id": "htdemucs_6s",
      "version": "4.0.1",
      "weights_sha256": "9aa7d212a26ffa8468b6e96e1402c318cc9a3bfc48e9dc12b3687b120ec27510",
      "provider": "self_hosted",
      "register_tier": "amber"
    }
  ],
  "params": {
    "instrument": "guitar",
    "chain": ["bs_roformer_sw", "htdemucs_6s"],
    "keep": ["drums", "bass"]
  },
  "created_at": "2026-10-20T12:00:50Z",
  "target": "guitar",
  "provider": "htdemucs_6s",
  "mix_minus": "subtract",
  "device": "mps",
  "stems": [
    {
      "name": "guitar",
      "instrument": "guitar",
      "role": "target",
      "file": "3f9a0c1d2b4e5f60/guitar.flac",
      "sha256": "1b4f0e9851971998e732078544c96b36c3d01cedf7caa332359d6f1d83567014",
      "frames": 904050
    },
    {
      "name": "drums",
      "instrument": "drums",
      "role": "extra",
      "file": "3f9a0c1d2b4e5f60/drums.flac",
      "sha256": "60303ae22b998861bce3b28f33eec1be758a213c86c93c076dbe9f558c11c752",
      "frames": 904050
    }
  ],
  "failed_attempts": [{ "model": "bs_roformer_sw", "error_code": "separation_mps_failed" }]
}
